id,label,color,gradientFrom,gradientTo,description
pile-testing,Pile Testing,#7c3aed,purple-500,purple-700,Dynamic and static pile load testing equipment for foundation quality assurance
drilling,Drilling,#6d28d9,purple-600,purple-800,Core drilling and borehole investigation rigs for subsurface exploration
laboratory,Laboratory,#8b5cf6,purple-400,purple-600,Soil and rock testing laboratory instruments for material characterization
geophysical,Geophysical,#5b21b6,purple-700,purple-900,Geophysical survey and subsurface investigation tools for site characterization
field-testing,Field Testing,#6366f1,indigo-600,purple-700,In-situ field testing equipment for on-site soil investigation
